{
  "protocol_version": "1.0",
  "workspace_id": "20000000-0000-4000-8000-000000000001",
  "epoch": "70000000-0000-4000-8000-000000000001",
  "asset_id": "70000000-0000-4000-8000-000000000007",
  "asset_revision": "1",
  "upload_id": "70000000-0000-4000-8000-000000000008",
  "chunk_bytes": 262144,
  "chunk_count": 3,
  "byte_length": "524289",
  "received_chunks": [
    0,
    1
  ],
  "expires_at_utc": "2026-10-25T12:00:00.000Z"
}
